{
  "file": "dji_mimo_20261012_113618_0051_1791817331815_video.mp4",
  "path": "/media/yt-test/proxy/dji_mimo_20261012_113618_0051_1791817331815_video.mp4",
  "generated_at": "2026-10-12T21:31:00+00:00",
  "duration_s": 21.93,
  "fps_source": 25.0,
  "analysis": {
    "method": "lucas_kanade_affine_partial_ransac",
    "source": "optical_flow",
    "sample_fps": 10.0,
    "width": 320,
    "frames_analyzed": 219
  },
  "trajectory": [
    {
      "t": 0.05,
      "dx": 0.0,
      "dy": 0.0,
      "scale": 1.0,
      "roll_deg": 0.0,
      "inlier_ratio": 0.95,
      "speed": 0.0,
      "shake": 0.01
    },
    {
      "t": 5.05,
      "dx": 0.04,
      "dy": -0.002,
      "scale": 1.0,
      "roll_deg": 0.05,
      "inlier_ratio": 0.88,
      "speed": 0.4,
      "shake": 0.03
    }
  ],
  "phases": [
    {
      "start_s": 0.0,
      "end_s": 2.0,
      "type": "still",
      "dominant_motion": "static",
      "speed": "slow",
      "steadiness": "static"
    },
    {
      "start_s": 2.0,
      "end_s": 3.0,
      "type": "ramp_up",
      "dominant_motion": "pan_right",
      "speed": "regular",
      "steadiness": "no_shaking"
    },
    {
      "start_s": 3.0,
      "end_s": 12.0,
      "type": "steady_move",
      "dominant_motion": "pan_right",
      "speed": "regular",
      "steadiness": "minimal_shaking"
    },
    {
      "start_s": 12.0,
      "end_s": 13.0,
      "type": "ramp_down",
      "dominant_motion": "pan_right",
      "speed": "slow",
      "steadiness": "no_shaking"
    },
    {
      "start_s": 13.0,
      "end_s": 21.93,
      "type": "still",
      "dominant_motion": "static",
      "speed": "slow",
      "steadiness": "static"
    }
  ],
  "moves": [
    {
      "id": "m1",
      "start_s": 2.0,
      "end_s": 13.0,
      "label": "pan_right",
      "speed": "regular",
      "steadiness": "minimal_shaking",
      "steady_start_s": 3.0,
      "steady_end_s": 12.0,
      "handle_in_s": 2.6,
      "handle_out_s": 12.4,
      "confidence": 0.82,
      "mean_dx": 0.04,
      "mean_dy": -0.002,
      "mean_scale": 1.0,
      "mean_roll_deg": 0.05,
      "semantic_check": false,
      "notes": ""
    }
  ],
  "scene_activity": [
    {"t_s": 0.5, "activity": 0.0012},
    {"t_s": 1.5, "activity": 0.0011},
    {"t_s": 2.5, "activity": 0.0013}
  ],
  "events": [],
  "warnings": []
}
